{
  "$schema": "https://json-schema.org/draft/2020-12/schema",
  "title": "WaveReport",
  "description": "`aurora wave`.",
  "type": "object",
  "properties": {
    "waveform": {
      "description": "A onda aberta.",
      "type": "string"
    },
    "pid": {
      "description": "O processo do surfer-aurora, que continua aberto.",
      "type": "integer",
      "format": "uint32",
      "minimum": 0
    },
    "log": {
      "description": "Onde vai o stdout e o stderr do surfer-aurora.",
      "type": "string"
    },
    "layout": {
      "description": "O estado do Surfer com que a onda abriu (`.surf.ron`): o layout salvo\nno projeto ou o gerado; `null` com `--no-layout`, numa onda sem sinal\npara mostrar ou que não é VCD nem FST.",
      "type": [
        "string",
        "null"
      ]
    },
    "saved_layout": {
      "description": "O layout salvo no projeto (`wave/<testbench>.surf.ron`), onde o\nSurfer salva (Ctrl+S); `null` numa onda fora de projeto.",
      "anyOf": [
        {
          "$ref": "#/$defs/SavedLayoutReport"
        },
        {
          "type": "null"
        }
      ]
    },
    "processors": {
      "description": "Os processadores do layout.",
      "type": "array",
      "items": {
        "$ref": "#/$defs/WaveProcessor"
      }
    }
  },
  "required": [
    "waveform",
    "pid",
    "log",
    "layout",
    "saved_layout",
    "processors"
  ],
  "$defs": {
    "SavedLayoutReport": {
      "description": "O layout salvo no projeto para a onda aberta.",
      "type": "object",
      "properties": {
        "path": {
          "description": "O arquivo.",
          "type": "string"
        },
        "customized": {
          "description": "O usuário salvou depois que o Lace o gerou: o Lace não o refaz\n(`aurora wave --reset-layout` volta ao gerado).",
          "type": "boolean"
        }
      },
      "required": [
        "path",
        "customized"
      ]
    },
    "WaveProcessor": {
      "description": "Um processador SAPHO achado na onda.",
      "type": "object",
      "properties": {
        "instance": {
          "description": "O escopo da instância na onda (`soma_tb.proc`).",
          "type": "string"
        },
        "processor": {
          "description": "O processador (o nome da pasta no projeto e do fonte).",
          "type": "string"
        },
        "variables": {
          "description": "Quantas variáveis do programa estão na onda (cada elemento de array\nconta).",
          "type": "integer",
          "format": "uint",
          "minimum": 0
        },
        "assembly": {
          "description": "O PC aparece como instrução de assembly (havia `trad_opcode.txt`).",
          "type": "boolean"
        },
        "source": {
          "description": "A linha do fonte aparece como texto (havia `src_lines.txt`).",
          "type": "boolean"
        },
        "outdated": {
          "description": "As tabelas são mais novas que a onda: o processador foi compilado de\nnovo depois da simulação, e o assembly e a linha do C± sairiam\ndeslocados. O PC e a linha aparecem como números até simular de novo;\nas interfaces avisam.",
          "type": "boolean"
        }
      },
      "required": [
        "instance",
        "processor",
        "variables",
        "assembly",
        "source",
        "outdated"
      ]
    }
  }
}
